PREFERRED_NAME,LONG_NAME,PREFERRED_DEFINITION,EVS_SOURCE,ORIGIN,DEFINITION_SOURCE,
C143560,Hyperthyroidism,A disorder characterized by excessive levels of thyroid hormone in the body. Common causes include an overactive thyroid gland or thyroid hormone overdose.,NCI_CONCEPT_CODE,NCI Thesaurus,NCI,NCI
C143561,Hypertrichosis,"A disorder characterized by hair density or length beyond the accepted limits of normal in a particular body region, for a particular age or race.",NCI_CONCEPT_CODE,NCI Thesaurus,NCI,NCI
C143562,Hypertriglyceridemia,A disorder characterized by laboratory test results that indicate an elevation in the concentration of triglyceride concentration in the blood.,NCI_CONCEPT_CODE,NCI Thesaurus,NCI,NCI
C143563,Hyperuricemia,A disorder characterized by laboratory test results that indicate an elevation in the concentration of uric acid.,NCI_CONCEPT_CODE,NCI Thesaurus,NCI,NCI
C143564,Hypoalbuminemia,A disorder characterized by laboratory test results that indicate a low concentration of albumin in the blood.,NCI_CONCEPT_CODE,NCI Thesaurus,NCI,NCI
C143565,Hypocalcemia,A disorder characterized by laboratory test results that indicate a low concentration of calcium (corrected for albumin) in the blood.,NCI_CONCEPT_CODE,NCI Thesaurus,NCI,NCI
C143566,Hypoglossal nerve disorder,A disorder characterized by dysfunction of the hypoglossal nerve (twelfth cranial nerve).,NCI_CONCEPT_CODE,NCI Thesaurus,NCI,NCI
C143567,Hypoglycemia,A disorder characterized by laboratory test results that indicate a low concentration of glucose in the blood.,NCI_CONCEPT_CODE,NCI Thesaurus,NCI,NCI
C143568,Hypohidrosis,A disorder characterized by reduced sweating.,NCI_CONCEPT_CODE,NCI Thesaurus,NCI,NCI
C143569,Hypokalemia,A disorder characterized by laboratory test results that indicate a low concentration of potassium in the blood.,NCI_CONCEPT_CODE,NCI Thesaurus,NCI,NCI
C143570,Hypomagnesemia,A disorder characterized by laboratory test results that indicate a low concentration of magnesium in the blood.,NCI_CONCEPT_CODE,NCI Thesaurus,NCI,NCI
C143571,Hyponatremia,A disorder characterized by laboratory test results that indicate a low concentration of sodium in the blood.,NCI_CONCEPT_CODE,NCI Thesaurus,NCI,NCI
C143572,Hypoparathyroidism,A disorder characterized by a decrease in production of parathyroid hormone by the parathyroid glands.,NCI_CONCEPT_CODE,NCI Thesaurus,NCI,NCI
C143573,Hypophosphatemia,A disorder characterized by laboratory test results that indicate a low concentration of phosphates in the blood.,NCI_CONCEPT_CODE,NCI Thesaurus,NCI,NCI
C143576,Hypothyroidism,A disorder characterized by a decrease in production of thyroid hormone by the thyroid gland.,NCI_CONCEPT_CODE,NCI Thesaurus,NCI,NCI
C143578,Ileal stenosis,A disorder characterized by a narrowing of the lumen of the ileum.,NCI_CONCEPT_CODE,NCI Thesaurus,NCI,NCI
C143580,"Immune system disorders - Other, specify",,NCI_CONCEPT_CODE,NCI Thesaurus,NCI,NCI
C143581,"Infections and infestations - Other, specify",,NCI_CONCEPT_CODE,NCI Thesaurus,NCI,NCI
C143582,Infective myositis,A disorder characterized by an infectious process involving the skeletal muscles.,NCI_CONCEPT_CODE,NCI Thesaurus,NCI,NCI
C143583,Infusion related reaction,A disorder characterized by adverse reaction to the infusion of pharmacological or biological substances.,NCI_CONCEPT_CODE,NCI Thesaurus,NCI,NCI
C143584,Infusion site extravasation,"A disorder characterized by leakage of the infusion into the surrounding tissue. Signs and symptoms may include induration, erythema, swelling, burning sensation and marked discomfort at the infusion site.",NCI_CONCEPT_CODE,NCI Thesaurus,NCI,NCI
C143585,Injection site reaction,A disorder characterized by an intense adverse reaction (usually immunologic) developing at the site of an injection.,NCI_CONCEPT_CODE,NCI Thesaurus,NCI,NCI
C143586,Injury to carotid artery,A finding of damage to the carotid artery.,NCI_CONCEPT_CODE,NCI Thesaurus,NCI,NCI
C143587,Injury to jugular vein,A finding of damage to the jugular vein.,NCI_CONCEPT_CODE,NCI Thesaurus,NCI,NCI
C143588,Injury to superior vena cava,A finding of damage to the superior vena cava.,NCI_CONCEPT_CODE,NCI Thesaurus,NCI,NCI
C143589,"Injury, poisoning and procedural complications - Other, specify",,NCI_CONCEPT_CODE,NCI Thesaurus,NCI,NCI
C143590,INR increased,A finding based on laboratory test results that indicate an increase in the ratio of the patient's prothrombin time to a control sample in the blood.,NCI_CONCEPT_CODE,NCI Thesaurus,NCI,NCI
C143592,Intestinal stoma leak,A finding of leakage of contents from an intestinal stoma (surgically created opening on the surface of the body).,NCI_CONCEPT_CODE,NCI Thesaurus,NCI,NCI
C143593,Intestinal stoma obstruction,A disorder characterized by blockage of the normal flow of the contents of the intestinal stoma.,NCI_CONCEPT_CODE,NCI Thesaurus,NCI,NCI
C143594,Intestinal stoma site bleeding,A disorder characterized by bleeding from the intestinal stoma.,NCI_CONCEPT_CODE,NCI Thesaurus,NCI,NCI
C143595,Intra-abdominal hemorrhage,A disorder characterized by bleeding in the abdominal cavity.,NCI_CONCEPT_CODE,NCI Thesaurus,NCI,NCI
C143596,Intracranial hemorrhage,A disorder characterized by bleeding from the cranium.,NCI_CONCEPT_CODE,NCI Thesaurus,NCI,NCI
C143597,Intraoperative arterial injury,A finding of damage to an artery during a surgical procedure.,NCI_CONCEPT_CODE,NCI Thesaurus,NCI,NCI
C143598,Intraoperative breast injury,A finding of damage to the breast parenchyma during a surgical procedure.,NCI_CONCEPT_CODE,NCI Thesaurus,NCI,NCI
C143599,Intraoperative cardiac injury,A finding of damage to the heart during a surgical procedure.,NCI_CONCEPT_CODE,NCI Thesaurus,NCI,NCI
C143600,Intraoperative ear injury,A finding of damage to the ear during a surgical procedure.,NCI_CONCEPT_CODE,NCI Thesaurus,NCI,NCI
C143601,Intraoperative endocrine injury,A finding of damage to the endocrine gland during a surgical procedure.,NCI_CONCEPT_CODE,NCI Thesaurus,NCI,NCI
C143602,Intraoperative gastrointestinal injury,A finding of damage to the gastrointestinal system during a surgical procedure.,NCI_CONCEPT_CODE,NCI Thesaurus,NCI,NCI
C143603,Intraoperative head and neck injury,A finding of damage to the head and neck during a surgical procedure.,NCI_CONCEPT_CODE,NCI Thesaurus,NCI,NCI
C143604,Intraoperative hemorrhage,A finding of uncontrolled bleeding during a surgical procedure.,NCI_CONCEPT_CODE,NCI Thesaurus,NCI,NCI
C143605,Intraoperative hepatobiliary injury,A finding of damage to the hepatic parenchyma and/or biliary tract during a surgical procedure.,NCI_CONCEPT_CODE,NCI Thesaurus,NCI,NCI
C143606,Intraoperative musculoskeletal injury,A finding of damage to the musculoskeletal system during a surgical procedure.,NCI_CONCEPT_CODE,NCI Thesaurus,NCI,NCI
C143607,Intraoperative neurological injury,A finding of damage to the nervous system during a surgical procedure.,NCI_CONCEPT_CODE,NCI Thesaurus,NCI,NCI
C143608,Intraoperative ocular injury,A finding of damage to the eye during a surgical procedure.,NCI_CONCEPT_CODE,NCI Thesaurus,NCI,NCI
C143609,Intraoperative renal injury,A finding of damage to the kidney during a surgical procedure.,NCI_CONCEPT_CODE,NCI Thesaurus,NCI,NCI
C143610,Intraoperative reproductive tract injury,A finding of damage to the reproductive organs during a surgical procedure.,NCI_CONCEPT_CODE,NCI Thesaurus,NCI,NCI
C143611,Intraoperative respiratory injury,A finding of damage to the respiratory system during a surgical procedure.,NCI_CONCEPT_CODE,NCI Thesaurus,NCI,NCI
C143612,Intraoperative splenic injury,A finding of damage to the spleen during a surgical procedure.,NCI_CONCEPT_CODE,NCI Thesaurus,NCI,NCI
C143613,Intraoperative urinary injury,A finding of damage to the urinary system during a surgical procedure.,NCI_CONCEPT_CODE,NCI Thesaurus,NCI,NCI
C143614,Intraoperative venous injury,A finding of damage to a vein during a surgical procedure.,NCI_CONCEPT_CODE,NCI Thesaurus,NCI,NCI
C143615,"Investigations - Other, specify",,NCI_CONCEPT_CODE,NCI Thesaurus,NCI,NCI
C143617,Irregular menstruation,A disorder characterized by a change in cycle or duration of menses from baseline.,NCI_CONCEPT_CODE,NCI Thesaurus,NCI,NCI
C143618,Irritability,"A disorder characterized by an abnormal responsiveness to stimuli or physiological arousal; may be in response to pain, fright, a drug, an emotional situation or a medical condition.",NCI_CONCEPT_CODE,NCI Thesaurus,NCI,NCI
C143619,Ischemia cerebrovascular,A disorder characterized by a decrease or absence of blood supply to the brain caused by obstruction (thrombosis or embolism) of an artery resulting in neurological damage.,NCI_CONCEPT_CODE,NCI Thesaurus,NCI,NCI
C143622,Jejunal perforation,A disorder characterized by a rupture in the jejunal wall.,NCI_CONCEPT_CODE,NCI Thesaurus,NCI,NCI
C143623,Jejunal stenosis,A disorder characterized by a narrowing of the lumen of the jejunum.,NCI_CONCEPT_CODE,NCI Thesaurus,NCI,NCI
C143626,Joint infection,A disorder characterized by an infectious process involving a joint.,NCI_CONCEPT_CODE,NCI Thesaurus,NCI,NCI
C143627,Joint range of motion decreased cervical spine,A disorder characterized by a decrease in flexibility of a cervical spine joint.,NCI_CONCEPT_CODE,NCI Thesaurus,NCI,NCI
C143628,Joint range of motion decreased lumbar spine,A disorder characterized by a decrease in flexibility of a lumbar spine joint.,NCI_CONCEPT_CODE,NCI Thesaurus,NCI,NCI
C143629,Joint range of motion decreased,A disorder characterized by a decrease in joint flexibility of any joint.,NCI_CONCEPT_CODE,NCI Thesaurus,NCI,NCI
C143631,Kidney anastomotic leak,A finding of leakage of urine due to breakdown of a kidney anastomosis (surgical connection of two separate anatomic structures).,NCI_CONCEPT_CODE,NCI Thesaurus,NCI,NCI
C143632,Kidney infection,A disorder characterized by an infectious process involving the kidney.,NCI_CONCEPT_CODE,NCI Thesaurus,NCI,NCI
C143633,Kyphosis,A disorder characterized by an abnormal increase in the curvature of the thoracic portion of the spine.,NCI_CONCEPT_CODE,NCI Thesaurus,NCI,NCI
C143634,Lactation disorder,A disorder characterized by disturbances of milk secretion. It is not necessarily related to pregnancy that is observed in females and can be observed in males.,NCI_CONCEPT_CODE,NCI Thesaurus,NCI,NCI
C143635,Large intestinal anastomotic leak,A finding of leakage due to breakdown of an anastomosis (surgical connection of two separate anatomic structures) in the large intestine.,NCI_CONCEPT_CODE,NCI Thesaurus,NCI,NCI
C143636,Laryngeal edema,A disorder characterized by swelling due to an excessive accumulation of fluid in the larynx.,NCI_CONCEPT_CODE,NCI Thesaurus,NCI,NCI
C143637,Laryngeal inflammation,A disorder characterized by an inflammation involving the larynx.,NCI_CONCEPT_CODE,NCI Thesaurus,NCI,NCI
C143638,Laryngeal mucositis,A disorder characterized by ulceration or inflammation involving the mucous membrane of the larynx.,NCI_CONCEPT_CODE,NCI Thesaurus,NCI,NCI
C143639,Laryngeal obstruction,A disorder characterized by blockage of the laryngeal airway.,NCI_CONCEPT_CODE,NCI Thesaurus,NCI,NCI
C143640,Laryngeal stenosis,A disorder characterized by a narrowing of the laryngeal airway.,NCI_CONCEPT_CODE,NCI Thesaurus,NCI,NCI
C143641,Laryngitis,A disorder characterized by an inflammatory process involving the larynx.,NCI_CONCEPT_CODE,NCI Thesaurus,NCI,NCI
C143642,Laryngopharyngeal dysesthesia,A disorder characterized by an uncomfortable persistent sensation in the area of the laryngopharynx.,NCI_CONCEPT_CODE,NCI Thesaurus,NCI,NCI
C143643,Laryngospasm,A disorder characterized by paroxysmal spasmodic muscular contraction of the vocal cords.,NCI_CONCEPT_CODE,NCI Thesaurus,NCI,NCI
C143645,Lethargy,A disorder characterized by a decrease in consciousness characterized by mental and physical inertness.,NCI_CONCEPT_CODE,NCI Thesaurus,NCI,NCI
C143646,Leukemia secondary to oncology chemotherapy,A disorder characterized by leukemia arising as a result of the mutagenic effect of chemotherapy agents.,NCI_CONCEPT_CODE,NCI Thesaurus,NCI,NCI
C143647,Leukocytosis,A disorder characterized by laboratory test results that indicate an increased number of white blood cells in the blood.,NCI_CONCEPT_CODE,NCI Thesaurus,NCI,NCI
C143648,Leukoencephalopathy,A disorder characterized by diffuse reactive astrocytosis with multiple areas of necrotic foci without inflammation.,NCI_CONCEPT_CODE,NCI Thesaurus,NCI,NCI
C143649,Libido decreased,A disorder characterized by a decrease in sexual desire.,NCI_CONCEPT_CODE,NCI Thesaurus,NCI,NCI
C143650,Libido increased,A disorder characterized by an increase in sexual desire.,NCI_CONCEPT_CODE,NCI Thesaurus,NCI,NCI
C143651,Lip infection,A disorder characterized by an infectious process involving the lips.,NCI_CONCEPT_CODE,NCI Thesaurus,NCI,NCI
C143652,Lipase increased,A finding based on laboratory test results that indicate an increase in the level of lipase in a biological specimen.,NCI_CONCEPT_CODE,NCI Thesaurus,NCI,NCI
C143653,Lipohypertrophy,A disorder characterized by hypertrophy of the subcutaneous adipose tissue at the site of multiple subcutaneous injections of insulin.,NCI_CONCEPT_CODE,NCI Thesaurus,NCI,NCI
C143654,Localized edema,A disorder characterized by swelling due to excessive fluid accumulation at a specific anatomic site.,NCI_CONCEPT_CODE,NCI Thesaurus,NCI,NCI
C143655,Lordosis,A disorder characterized by an abnormal increase in the curvature of the lumbar portion of the spine.,NCI_CONCEPT_CODE,NCI Thesaurus,NCI,NCI
C143656,Lower gastrointestinal hemorrhage,"A disorder characterized by bleeding from the lower gastrointestinal tract (small intestine, large intestine, and anus).",NCI_CONCEPT_CODE,NCI Thesaurus,NCI,NCI
C143657,Lung infection,"A disorder characterized by an infectious process involving the lungs, including pneumonia.",NCI_CONCEPT_CODE,NCI Thesaurus,NCI,NCI
C143658,Lymph gland infection,A disorder characterized by an infectious process involving the lymph nodes.,NCI_CONCEPT_CODE,NCI Thesaurus,NCI,NCI
C143659,Lymph leakage,A disorder characterized by the loss of lymph fluid into the surrounding tissue or body cavity.,NCI_CONCEPT_CODE,NCI Thesaurus,NCI,NCI
C143660,Lymphedema,A disorder characterized by excessive fluid collection in tissues that causes swelling.,NCI_CONCEPT_CODE,NCI Thesaurus,NCI,NCI
C143662,Lymphocyte count decreased,A finding based on laboratory test results that indicate a decrease in number of lymphocytes in a blood specimen.,NCI_CONCEPT_CODE,NCI Thesaurus,NCI,NCI
C143663,Lymphocyte count increased,"A finding based on laboratory test results that indicate an abnormal increase in the number of lymphocytes in the blood, effusions or bone marrow.",NCI_CONCEPT_CODE,NCI Thesaurus,NCI,NCI
C143665,Malaise,"A disorder characterized by a feeling of general discomfort or uneasiness, an out-of-sorts feeling.",NCI_CONCEPT_CODE,NCI Thesaurus,NCI,NCI
C143666,Mania,"A disorder characterized by excitement of psychotic proportions manifested by mental and physical hyperactivity, disorganization of behavior and elevation of mood.",NCI_CONCEPT_CODE,NCI Thesaurus,NCI,NCI
C143667,Mediastinal infection,A disorder characterized by an infectious process involving the mediastinum.,NCI_CONCEPT_CODE,NCI Thesaurus,NCI,NCI
C143669,Meningismus,"A disorder characterized by neck stiffness, headache, and photophobia resulting from irritation of the cerebral meninges.",NCI_CONCEPT_CODE,NCI Thesaurus,NCI,NCI
C143670,Meningitis,A disorder characterized by acute inflammation of the meninges of the brain and/or spinal cord.,NCI_CONCEPT_CODE,NCI Thesaurus,NCI,NCI
C143671,Menorrhagia,A disorder characterized by abnormally heavy vaginal bleeding during menses.,NCI_CONCEPT_CODE,NCI Thesaurus,NCI,NCI
C143672,"Metabolism and nutrition disorders - Other, specify",,NCI_CONCEPT_CODE,NCI Thesaurus,NCI,NCI
C143673,Middle ear inflammation,"A disorder characterized by inflammation (physiologic response to irritation), swelling and redness to the middle ear.",NCI_CONCEPT_CODE,NCI Thesaurus,NCI,NCI
C143674,Mitral valve disease,A disorder characterized by a defect in mitral valve function or structure.,NCI_CONCEPT_CODE,NCI Thesaurus,NCI,NCI
C143677,Movements involuntary,A disorder characterized by uncontrolled and purposeless movements.,NCI_CONCEPT_CODE,NCI Thesaurus,NCI,NCI
C143678,Mucosal infection,A disorder characterized by an infectious process involving a mucosal surface.,NCI_CONCEPT_CODE,NCI Thesaurus,NCI,NCI
C143679,Mucositis oral,A disorder characterized by ulceration or inflammation of the oral mucosal.,NCI_CONCEPT_CODE,NCI Thesaurus,NCI,NCI
C143680,Multi-organ failure,"A disorder characterized by progressive deterioration of the lungs, liver, kidney and clotting mechanisms.",NCI_CONCEPT_CODE,NCI Thesaurus,NCI,NCI
C143681,Muscle weakness left-sided,A disorder characterized by a reduction in the strength of the muscles on the left side of the body.,NCI_CONCEPT_CODE,NCI Thesaurus,NCI,NCI
C143682,Muscle weakness lower limb,A disorder characterized by a reduction in the strength of the lower limb muscles.,NCI_CONCEPT_CODE,NCI Thesaurus,NCI,NCI
C143683,Muscle weakness right-sided,A disorder characterized by a reduction in the strength of the muscles on the right side of the body.,NCI_CONCEPT_CODE,NCI Thesaurus,NCI,NCI
C143684,Muscle weakness trunk,A disorder characterized by a reduction in the strength of the trunk muscles.,NCI_CONCEPT_CODE,NCI Thesaurus,NCI,NCI
C143685,Muscle weakness upper limb,A disorder characterized by a reduction in the strength of the upper limb muscles.,NCI_CONCEPT_CODE,NCI Thesaurus,NCI,NCI
C143686,"Musculoskeletal and connective tissue disorder - Other, specify",,NCI_CONCEPT_CODE,NCI Thesaurus,NCI,NCI
C143687,Musculoskeletal deformity,A disorder characterized by a malformation of the musculoskeletal system.,NCI_CONCEPT_CODE,NCI Thesaurus,NCI,NCI
C143688,Myalgia,A disorder characterized by marked discomfort sensation originating from a muscle or group of muscles.,NCI_CONCEPT_CODE,NCI Thesaurus,NCI,NCI
C143690,Myelodysplastic syndrome,A disorder characterized by insufficiently healthy hematapoietic cell production by the bone marrow.,NCI_CONCEPT_CODE,NCI Thesaurus,NCI,NCI
C143691,Myocardial infarction,A disorder characterized by gross necrosis of the myocardium; this is due to an interruption of blood supply to the area.,NCI_CONCEPT_CODE,NCI Thesaurus,NCI,NCI
C143694,Nail discoloration,A disorder characterized by a change in the color of the nail plate.,NCI_CONCEPT_CODE,NCI Thesaurus,NCI,NCI
C143695,Nail infection,A disorder characterized by an infectious process involving the nail.,NCI_CONCEPT_CODE,NCI Thesaurus,NCI,NCI
C143696,Nail loss,A disorder characterized by loss of all or a portion of the nail.,NCI_CONCEPT_CODE,NCI Thesaurus,NCI,NCI
C143697,Nail ridging,A disorder characterized by vertical or horizontal ridges on the nails.,NCI_CONCEPT_CODE,NCI Thesaurus,NCI,NCI
C143698,Nasal congestion,A disorder characterized by obstruction of the nasal passage due to mucosal edema.,NCI_CONCEPT_CODE,NCI Thesaurus,NCI,NCI
C143700,Neck edema,A disorder characterized by swelling due to an accumulation of excessive fluid in the neck.,NCI_CONCEPT_CODE,NCI Thesaurus,NCI,NCI
C143701,"Neoplasms benign, malignant and unspecified (incl cysts and polyps) - Other, specify",,NCI_CONCEPT_CODE,NCI Thesaurus,NCI,NCI
C143702,"Nervous system disorders - Other, specify",,NCI_CONCEPT_CODE,NCI Thesaurus,NCI,NCI
C143703,Neuralgia,A disorder characterized by intense painful sensation along a nerve or group of nerves.,NCI_CONCEPT_CODE,NCI Thesaurus,NCI,NCI
C143704,Neutrophil count decreased,A finding based on laboratory test results that indicate a decrease in number of neutrophils in a blood specimen.,NCI_CONCEPT_CODE,NCI Thesaurus,NCI,NCI
C143705,Night blindness,A disorder characterized by an inability to see clearly in dim light.,NCI_CONCEPT_CODE,NCI Thesaurus,NCI,NCI
C143706,Nipple deformity,A disorder characterized by a malformation of the nipple.,NCI_CONCEPT_CODE,NCI Thesaurus,NCI,NCI
C143707,Non-cardiac chest pain,A disorder characterized by a sensation of marked discomfort in the chest unrelated to a heart disorder.,NCI_CONCEPT_CODE,NCI Thesaurus,NCI,NCI
C143710,Obstruction gastric,A disorder characterized by blockage of the normal flow of the contents in the stomach.,NCI_CONCEPT_CODE,NCI Thesaurus,NCI,NCI
C143711,Oculomotor nerve disorder,A disorder characterized by dysfunction of the oculomotor nerve (third cranial nerve).,NCI_CONCEPT_CODE,NCI Thesaurus,NCI,NCI
C143712,Olfactory nerve disorder,A disorder characterized by dysfunction of the olfactory nerve (first cranial nerve).,NCI_CONCEPT_CODE,NCI Thesaurus,NCI,NCI
C143713,Oligospermia,A disorder characterized by a decrease in the number of spermatozoa in the semen.,NCI_CONCEPT_CODE,NCI Thesaurus,NCI,NCI
C143714,Optic nerve disorder,A disorder characterized by involvement of the optic nerve (second cranial nerve).,NCI_CONCEPT_CODE,NCI Thesaurus,NCI,NCI
C143715,Oral cavity fistula,A disorder characterized by an abnormal communication between the oral cavity and another organ or anatomic site.,NCI_CONCEPT_CODE,NCI Thesaurus,NCI,NCI
C143716,Oral dysesthesia,"A disorder characterized by a burning or tingling sensation on the lips, tongue or entire mouth.",NCI_CONCEPT_CODE,NCI Thesaurus,NCI,NCI
C143717,Osteonecrosis of jaw,A disorder characterized by a necrotic process occurring in the bone of the mandible.,NCI_CONCEPT_CODE,NCI Thesaurus,NCI,NCI
C143719,Otitis externa,"A disorder characterized by an infectious process involving the outer ear and ear canal. Contributory factors include excessive water exposure (swimmer's ear infection) and cuts in the ear canal. Symptoms include fullness, itching, swelling and marked discomfort in the ear and ear drainage.",NCI_CONCEPT_CODE,NCI Thesaurus,NCI,NCI
C143720,Otitis media,A disorder characterized by an infectious process involving the middle ear.,NCI_CONCEPT_CODE,NCI Thesaurus,NCI,NCI
C143721,Ovarian infection,A disorder characterized by an infectious process involving the ovary.,NCI_CONCEPT_CODE,NCI Thesaurus,NCI,NCI
C143722,Ovarian rupture,A disorder characterized by tearing or disruption of the ovarian tissue.,NCI_CONCEPT_CODE,NCI Thesaurus,NCI,NCI
C143723,Pain in extremity,A disorder characterized by a sensation of marked discomfort in the upper or lower extremities.,NCI_CONCEPT_CODE,NCI Thesaurus,NCI,NCI
C143724,Pain of skin,A disorder characterized by a sensation of marked discomfort in the skin.,NCI_CONCEPT_CODE,NCI Thesaurus,NCI,NCI
C143725,Pain,"A disorder characterized by the sensation of marked discomfort, distress or agony.",NCI_CONCEPT_CODE,NCI Thesaurus,NCI,NCI
C143726,Palmar-plantar erythrodysesthesia syndrome,"A disorder characterized by redness, marked discomfort, swelling, and tingling in the palms of the hands or the soles of the feet. Also known as Hand-Foot Syndrome.",NCI_CONCEPT_CODE,NCI Thesaurus,NCI,NCI
C143728,Pancreas infection,A disorder characterized by an infectious process involving the pancreas.,NCI_CONCEPT_CODE,NCI Thesaurus,NCI,NCI
C143729,Pancreatic anastomotic leak,A finding of leakage due to breakdown of a pancreatic anastomosis (surgical connection of two separate anatomic structures).,NCI_CONCEPT_CODE,NCI Thesaurus,NCI,NCI
C143730,Pancreatic duct stenosis,A disorder characterized by a narrowing of the lumen of the pancreatic duct.,NCI_CONCEPT_CODE,NCI Thesaurus,NCI,NCI
C143731,Pancreatic enzymes decreased,A finding based on laboratory test results that indicate an decrease in levels of pancreatic enzymes in a biological specimen.,NCI_CONCEPT_CODE,NCI Thesaurus,NCI,NCI
C143732,Pancreatic necrosis,A disorder characterized by a necrotic process occurring in the pancreas.,NCI_CONCEPT_CODE,NCI Thesaurus,NCI,NCI
C143734,Papilledema,A disorder characterized by swelling around the optic disc.,NCI_CONCEPT_CODE,NCI Thesaurus,NCI,NCI
C143735,Papulopustular rash,"A disorder characterized by an eruption consisting of papules (a small, raised pimple) and pustules (a small pus filled blister), typically appearing in face, scalp, and upper chest and back. Unlike acne, this rash does not present with whiteheads or blackheads, and can be symptomatic, with itchy or tender lesions.",NCI_CONCEPT_CODE,NCI Thesaurus,NCI,NCI
C143736,Paresthesia,"A disorder characterized by functional disturbances of sensory neurons resulting in abnormal cutaneous sensations of tingling, numbness, pressure, cold, and/or warmth.",NCI_CONCEPT_CODE,NCI Thesaurus,NCI,NCI
C143737,Paronychia,A disorder characterized by an infectious process involving the soft tissues around the nail.,NCI_CONCEPT_CODE,NCI Thesaurus,NCI,NCI
C143738,Paroxysmal atrial tachycardia,A disorder characterized by a dysrhythmia with abrupt onset and sudden termination of atrial contractions with a rate of 150-250 beats per minute. The rhythm disturbance originates in the atria.,NCI_CONCEPT_CODE,NCI Thesaurus,NCI,NCI
C143739,Pelvic floor muscle weakness,A disorder characterized by a reduction in the strength of the muscles of the pelvic floor.,NCI_CONCEPT_CODE,NCI Thesaurus,NCI,NCI
C143740,Pelvic infection,A disorder characterized by an infectious process involving the pelvic cavity.,NCI_CONCEPT_CODE,NCI Thesaurus,NCI,NCI
C143741,Penile infection,A disorder characterized by an infectious process involving the penis.,NCI_CONCEPT_CODE,NCI Thesaurus,NCI,NCI
C143742,Perforation bile duct,A disorder characterized by a rupture in the wall of the extrahepatic or intrahepatic bile duct.,NCI_CONCEPT_CODE,NCI Thesaurus,NCI,NCI
C143743,Pericardial effusion,"A disorder characterized by fluid collection within the pericardial sac, usually due to inflammation.",NCI_CONCEPT_CODE,NCI Thesaurus,NCI,NCI
