"*Protocol Preferred Name (Also called Short Name) -  must be unique, some groups us the Protocol ID)",*Long Name,*Preferred Definition,*Context,Workflow Status,Origin,Type,Protocol ID,Phase,Organization
PX010101,Current Age,"The interviewer asks the respondent for his or her date of birth in MM/DD/YYYY format. If the respondent does not know his or her date of birth, the interviewer asks an alternative question to determine his or her age. NOTE: The current age of the respondent can be calculated, given the date of the interview.",PhenX,RELEASED,"NHANES: National Health and Nutrition Examination Survey, 2005-2006",interviewer,PX010101,,
PX010201,Birthplace,"The respondent completes the self-administered questionnaire by indicating his or her place of birth. If he or she was born in the United States, an additional question captures the state, if known. If he or she was not born in the United States, another open-ended question asks for this location.",PhenX,RELEASED,"ACS: American Community Survey, 2008",self_or_interviewer,PX010201,,
PX010301,Birthplace of Parents,"The respondent completes the self-administered questionnaire by indicating his or her biological mother's place of birth. If he or she was born in the United States, an additional question captures the state, if known. If he or she was not born in the United States another open-ended question asks for this location. The same procedures would be followed for obtaining the birthplace of the respondent's father.",PhenX,RELEASED,"ACS: American Community Survey, 2008",self_or_interviewer,PX010301,,
PX010401,Birthplace of Grandparents,"The respondent completes the self-administered questionnaire by indicating his or her maternal grandmother's place of birth. If he or she was born in the United States, an additional question captures the state, if known. If he or she was not born in the United States, another open-ended question asks for this location. The same procedures would be followed for obtaining the birthplace of the respondent's maternal grandfather, paternal grandmother, and paternal grandfather.",PhenX,RELEASED,"ACS: American Community Survey, 2008",self_or_interviewer,PX010401,,
PX010502,Ethnicity,"The interviewer asks the respondent if he or she considers himself or herself to be Hispanic, Latino or Spanish and, if so, asks an additional question about his or her specific Hispanic origin is asked. One or more Hispanic origin categories may be selected.",PhenX,RELEASED,"NHANES: National Health and Nutrition Examination Survey, 2013-2014, Demographics Module.",interviewer,PX010502,,
PX010602,Race,"The interviewer asks the respondent what race he or she considers himself or herself to be and hands the respondent a card with a list of race categories. The respondent is asked to pick one or more of the categories on the card. The interviewer enters the code for the race indicated or keys in an entry if the respondent chooses an ""other (specify)"" option.",PhenX,RELEASED,"NHANES: National Health and Nutrition Examination Survey, 2013-2014, Demographics Module.",interviewer,PX010602,,
PX010701,Gender,The interviewer asks the respondent (or proxy) to indicate his or her gender.,PhenX,RELEASED,"CHIS: California Health Interview Survey Adult Questionnaire, 2005",interviewer,PX010701,,
PX010801,Current Address,The interviewer reads the respondent's current address aloud for the respondent. Information is verified with the respondent and recorded.,PhenX,RELEASED,"NHANES: National Health and Nutrition Examination Survey, 2005-2006, Screener Module 1",interviewer,PX010801,,
PX010902,Current Marital Status,The interviewer asks the respondent about his or her current marital status by presenting a numbered card that lists answer choices. The respondent may select one category.,PhenX,RELEASED,"NSFG: National Survey of Family Growth, 2011-2013, Section A: Marital/Cohabiting Status",interviewer,PX010902,,
PX011001,Current Educational Attainment,The interviewer asks the respondent or proxy about his or her education completed to date. The respondent is asked to indicate the highest grade level or degree received at the time of the interview. A card with the categories printed on it is provided to the respondent for him or her to indicate one of the applicable categories.,PhenX,RELEASED,"NHANES: National Health and Nutrition Examination Survey, Demographics Module, 2005-2006",interviewer,PX011001,,
PX011101,Annual Family Income,The interviewer asks the respondent about his or her family's total income from all sources in the last calendar year. This is an open-ended question. Respondents who do not know or refuse to answer the first annual family income question are asked a series of bracketing questions to obtain the approximate amount.,PhenX,RELEASED,"NHIS: National Health Interview Survey Family Questionnaire, 2007",interviewer,PX011101,,
PX011201,Years Living in the U.S.,"The interviewer asks the respondent how long he or she has been in the United States, in years. The number of years (2 digits) is entered by the interviewer. If the respondent has been in the United States for less than 1 year, the entry is ""0.""",PhenX,RELEASED,"NHIS: National Health Interview Survey Family Questionnaire, 2007",interviewer,PX011201,,
PX011301,Current Employment Status,The interviewer asks the respondent about his or her current employment status.,PhenX,RELEASED,"PSID: Panel Study of Income Dynamics, 2007",interviewer,PX011301,,
PX011402,Household Roster - Relationships,"The respondent is asked to list all the people who currently live in the household, beginning with the person who owns or rents the dwelling (householder), followed by the spouse or partner of that person, and then other household members. For each person listed, the respondent reports relationship to the householder and spouse of householder, sex, age, and marital status.",PhenX,RELEASED,"GSS HEF: General Social Survey 2014, Household Enumeration Form Roster",interviewer,PX011402,,
PX011502,Health Insurance Coverage,"The respondent is asked about health insurance coverage. A number of possible types of health care coverage are included, not simply health insurance.",PhenX,RELEASED,Health Reform Monitoring Survey 2015,interviewer,PX011502,,
PX020101,Arm Span,"The individual stands against the wall with his or her arms outstretched at shoulder level. Measurement of the arm span is the maximum distance between the extended middle fingers of the right and left hands, measured across the back.",PhenX,RELEASED,Anthropometric standardization reference manual,measurement,PX020101,,
PX020201,Birth Weight - Birth Weight Abstracted from Medical Records,Birth weight abstracted from medical charts or perinatal databases or as reported in vital records,PhenX,RELEASED,Center for Disease Control and Prevention 2005-2006 National Vital Statistics System Birth Certificate Section,record,PX020201,,
PX020202,Birth Weight - Measured Weight at Birth,Measured weight at birth,PhenX,RELEASED,Global Network for Women's and Children's Health Research Manual of Operations,measurement,PX020202,,
PX020203,Birth Weight - Proxy Reported Birth Weight,Proxy-reported birth weight,PhenX,RELEASED,NHANES: 2005-2006 National Health and Nutrition Examination Survey Questionnaire,self_or_proxy,PX020203,,
PX020302,Body Composition - Body Composition by Dual-Energy X-Ray Absorptiometry,"Dual-energy X-ray absorptiometry (DXA) is one of the most widely used methods to assess body composition in a laboratory environment. A densitometer scanner device is used to scan the entire body or specific body sites such as the hip, spine, and limbs. DXA uses X-ray energy to measure body fat, muscle, and bone mineral and as a result, a small amount of radiation is delivered to the body during the DXA scan procedure. The results from a whole body DXA scan can be used to estimate total mass (gm), bone mineral content (BMC) (gm), bone area (cm<sup>2</sup>), bone mineral density, fat mass, lean mass excluding BMC (gm), lean mass including BMC (gm), and percent body fat (%). These measures can also be subdivided from the whole body to regional measures of the arms, legs, trunk, android, gynoid, and head. Furthermore, special algorithms have been created to estimate visceral and subcutaneous adipose tissue. Source: Centers for Disease Control and Prevention, National Center for Health Statistics, National Health and Nutrition Examination Survey (NHANES 2001-2002) DXA file documentation. URL: [link[www.cdc.gov/nchs/data/nhanes/dxa/dxx_b.pdf|http://www.cdc.gov/nchs/data/nhanes/dxa/dxx_b.pdf]] (accessed January 22, 2009).",PhenX,RELEASED,NHANES: 2011-2012 National Health and Nutrition Examination Survey Body Composition Procedures Manual,radiologic,PX020302,,
PX020303,Body Composition - Triceps Skinfold Thickness,"Measurement of the study subject subcutaneous fat mass using calipers to measure skinfold thickness over the triceps muscle. Skinfold thicknesses may also be measured at the number of other sites, including the midaxillary, pectoral, abdominal, anterior thigh, suprapatellar, medical calf, biceps, and forearm sites. If these latter sites are of interest, definitions and protocols are available in manuals that describe anthropometric measurements.",PhenX,RELEASED,NHANES: National Health and Nutrition Examination Survey 2007-2008 Anthropometry Procedures Manual,measurement,PX020303,,
PX020304,Body Composition - Subscapular Skinfold Thickness,"Measurement of the study subject subcutaneous fat mass using calipers to measure skinfold thickness at the subscapular. Skinfold thicknesses may also be measured at a number of other sites, including the midaxillary, pectoral, abdominal, anterior thigh, suprapatellar, medial calf, biceps, and forearm sites. If these latter sites are of interest, definitions and protocols are available in manuals that describe anthropometric measurements.",PhenX,RELEASED,NHANES: National Health and Nutrition Examination Survey 2007-2008 Anthropometry Procedures Manual,measurement,PX020304,,
PX020305,Body Composition - Suprailiac Skinfold Thickness,"Measurement of the study subject subcutaneous fat mass using calipers to measure skinfold thickness over the suprailiac site. Skinfold thicknesses may also be measured at the number of other sites, including the midaxillary, pectoral, abdominal, anterior thigh, suprapatellar, medical calf, biceps, and forearm sites. If these latter sites are of interest, definitions and protocols are available in manuals that describe anthropometric measurement.",PhenX,RELEASED,"NHANES: National Health and Nutrition Examination Survey III, 1988 Anthropometry Procedures Manual",measurement,PX020305,,
PX020401,Body Image,"This protocol encompasses the self-reported prior, current, or ideal body image of the respondents and their children. The majority of studies using pictograms have used the Stunkard Figure Rating Scale, which contains nine silhouettes on an ordinal scale. An alternative, the Collins scale, has also been provided. Specific pictograms for African Americans and children are also included.",PhenX,RELEASED,"Body Figure Perceptions Scales from Collins, Stunkard et al., and Pulvers et al.",self_or_proxy,PX020401,,
PX020501,Child Head Circumference,Measurement for children from birth to 36 months (Centers for Disease Control and Prevention growth charts) or 60 months (World Health Organization growth charts) of age. The parent or a health professional may need to hold the child while the examiner uses a tape measure to measure the child's head.,PhenX,RELEASED,NHANES: 2007-2008 National Health and Nutrition Examination Survey  Anthropometry Procedures Manual,measurement,PX020501,,
PX020601,Hand Dominance - 42 Months and Older,The protocol consists of questions to determine which hand the participant uses for a series of activities. Adults will assist children beginning at 42 months of age.,PhenX,RELEASED,ALSPCA: Avon Longitudinal Study of Parents and Children Protocol,interviewer,PX020601,,
PX020602,Hand Dominance - 12 Years and Older,The protocol consists of questions to determine which hand the participant uses for a series of activities.,PhenX,RELEASED,Edinburgh Handedness Inventory,self_or_proxy,PX020602,,
PX020701,Height - Knee Height,"Knee height is measured as the distance from the surface over the femoral condyles to the heel, with the knee flexed to approximately 90 degrees. This measure is used for individuals who are 60 years of age or older, who are unable to stand, or who have spinal deformities. It may be necessary to take replicate measurements.",PhenX,RELEASED,NHANES: 1988-1994 NHANES Body Measurements Protocol,physical,PX020701,,
PX020702,Height - Recumbent Length,"Recumbent length is measured from the top of the participant's head to his or her heels while he or she is lying recumbent. This measure is taken on neonates, infants, and young children. The Anthropometrics Working Group suggests that the measurements be taken to the nearest 0.1 cm.",PhenX,RELEASED,NHANES: 2007 National Health and Nutrition Examination Survey Anthropometry Procedures Manual,physical,PX020702,,
PX020703,Height - Standing Height,"Standing height is measured from the top of the participant's head to his or her heels. This measure is taken among participants, usually older than 2 years of age, who are able to stand unassisted. The Anthropometrics Expert Review Panel suggests that the measurements be taken to the nearest 0.1 cm.",PhenX,RELEASED,NHANES: 2007 National Health and Nutrition Examination Survey Anthropometry Procedures Manual,physical,PX020703,,
PX020704,Height - Self-Reported Height,The questions in the protocol ask the study subject his or her height.NOTE: Self-reported height values are considered to be less accurate. Self-reported height is subject to error and is used when measured height cannot be obtained.,PhenX,RELEASED,NHANES: 2007-2008 National Health and Nutrition Examination Survey  Weight History Questionnaire,self,PX020704,,
PX020802,Hip Circumference - Hip Circumference,Measurement of the hip girth at the level of the maximum protrusion of the buttocks.,PhenX,RELEASED,NHANES III: National Health and Nutrition Examination Survey III Body Measurements,physical,PX020802,,
PX020901,Maximum Adult Height,Self-reported maximum height,PhenX,RELEASED,NHANES: 2007-2008 National Health and Nutrition Examination Survey  Weight History Questionnaire,interviewer,PX020901,,
PX021001,Maximum Adult Weight,The protocol contains an interview question asking the study participant to recall his or her maximum adult weight.,PhenX,RELEASED,NHANES: 2007-2008 National Health and Nutrition Examination Survey  Weight History Questionnaire,interviewer,PX021001,,
PX021101,Mid-Upper Arm Circumference,Arm circumference is measured at the midpoint of the distance from the acromion process of the shoulder to the tip of the olecranon process of the elbow.,PhenX,RELEASED,NHANES: 2007-2008 National Health and Nutrition Examination Survey Anthropometry Procedures Manual,physical,PX021101,,
PX021301,Total Pregnancy Weight Gain - Self-Reported Weight Gain,"There are many research contexts in which one could collect this information, and how the information is collected will vary depending on the context.  For self-reported total weight gain during pregnancy, the participant is asked to report the total amount of weight gained during her most recent pregnancy. Other data to be collected at the same time are height, duration of the most recent pregnancy, and the date of the delivery.",PhenX,RELEASED,PRAMS: Pregnancy Risk Assessment Monitoring System Phase 5 Topic Reference Questionnaire,self_report,PX021301,,
PX021302,Total Pregnancy Weight Gain - Abstracted From Prenatal Charts,"There are several research contexts in which this information could be collected, and how the information is collected will vary depending on the context and availability of related information.  Weight gain during pregnancy is commonly monitored as a part of prenatal care. Total weight gain is calculated at the end of pregnancy (typically the last prenatal visit before delivery, and usually within 1 week of delivery) based on information abstracted from prenatal charts. ",PhenX,RELEASED,ACOG: Antenatal Form B and C,record_or_measurement,PX021302,,
PX021303,Total Pregnancy Weight Gain - Weight Measured During Gestation,"There are several research contexts in which this information could be collected, and how the information is collected will vary depending on the context and availability of related information.  Weight gain during pregnancy is commonly monitored as a part of prenatal care. Total weight gain is calculated at the end of pregnancy using a self-reported pre-pregnancy weight and weight measured at the last prenatal visit before delivery (usually within 1 week of delivery). The information to be collected would be (1) weight measured at final prenatal visit (to the nearest 100 g, e.g., 59.1 kg); (2) date of final visit; (3) pre-pregnancy weight; (4) height; (5) gestational age at final visit; and (6) gestational age at delivery. If the opportunity exists to collect the gestational weight prospectively as part of the research protocol, this is preferred because weights taken using a research protocol are better standardized for amount of participant clothing and scales are regularly calibrated. See [link[www.phenxtoolkit.org/index.php?pageLink=browse.protocoldetails&id=21501|Measured Weight]] protocol regarding the measurement of weight, and record weight to the nearest 100 g. Data to be collected are (1) weight during pregnancy; (2) date on which the weight is taken; (3) gestational age when measurement taken; (4) pre-pregnancy weight; (5) height; and (6) gestational age at delivery.",PhenX,RELEASED,ACOG: Antenatal Form B and C,self_report,PX021303,,
PX021401,Weight Loss/Gain,"The protocol contains a question about the participant's weight 1 year ago.**NOTE: This period can be modified for different periods. Depending on your hypothesis, you may want to modify the time interval as appropriate (e.g., 3 months, 6 months, 1 year).",PhenX,RELEASED,NHANES: 2007-2008 National Health and Nutrition Examination Survey  Weight History Questionnaire,interviewer,PX021401,,
PX021501,Weight - Measured Weight,"Weight is measured using a digital floor scale. The instrument should be calibrated daily using standardized weights, and a log of calibration results should be maintained.",PhenX,RELEASED,NHANES: 2007-2008 National Health and Nutrition Examination Survey  Anthropometry Procedures Manual,physical,PX021501,,
PX021502,Weight - Self-Reported Weight,The respondent provides his/her self-reported weight.,PhenX,RELEASED,NHANES: 2007-2008 National Health and Nutrition Examination Survey  Anthropometry Procedures Manual,self,PX021502,,
PX021601,Waist Circumference - Waist Circumference NHANES,"Waist circumference is measured at several body sites in the scientific literature. For the National Health and Nutrition Examination Survey (NHANES), the measurement of the participant's abdominal (waist) circumference is made at the uppermost lateral border of the ilium using a tape measure. This measurement protocol was developed specifically for NHANES III (1988-1994) to improve reliability by standardizing the bony landmarks needed to determine the plane for measurement, and it is rarely used outside of the United States. In both children and adults, and compared with measurements taken using other protocols, measurements taken over the iliac crest tend to be several centimeters larger than measurements taken midway between the lowest rib and iliac crest (Protocol 021601) or at the level of the umbilicus (Protocol 021603), except when waist circumference is measured at the level of the umbilicus in an obese participant and the umbilicus has been displaced downward (i.e., pendulous abdomen). This protocol is recommended for use by the National Heart, Lung, and Blood Institute to define central obesity (greater than 102 cm in men; greater than 88 cm in women), and references by race/ethnicity have been developed for children and adolescents. It should not be used to calculate a waist-to-height ratio (WHtR) because it will overestimate the prevalence in the abnormal range (WHtR greater than 0.5). The relationship of this measure with cardiometabolic risk factors is, however, comparable with waist circumference measures taken at other sites. NOTE: Waist circumference can be measured on pregnant women. However, national reference data do not include pregnant women, and waist circumference has different associations with abdominal and total body fat among those who are not pregnant. ",PhenX,RELEASED,NHANES: 2007-2008 National Health and Nutrition Examination Study Anthropometry Procedures Manual,physical,PX021601,,
PX021602,Waist Circumference - Waist Circumference NCFS,"Waist circumference is measured at several body sites in the scientific literature. During the National Children's Food Survey, the participant's waist circumference was measured midway between the lowest rib and the iliac crest. This protocol is used most commonly for adults and children in European, Asian, and South American surveys and studies, and for children, several area- or country-specific references are available to define a 90th percentile cutoff, which is the main criterion for metabolic syndrome in children. This is important because there are ethnic-specific cutoffs for central (i.e., abdominal) obesity in adults using waist circumference, and it is presumed that comparable racial/ethnic differences exist for children and adolescents. In both children and adults, and compared with measurements taken using other protocols, measurements taken midway between the lowest rib and the iliac crest tend to be several centimeters smaller than measurements taken over the iliac crest (NHANES protocol). It is more comparable with measurements taken at the level of the umbilicus (Framingham protocol), except when waist circumference is measured at the level of the umbilicus in an obese participant, and the umbilicus has been displaced downward (i.e., pendulous abdomen). This measurement can be used to calculate a waist-to-height ratio (WHtR) because it will accurately estimate the prevalence in the abnormal range (WHtR greater than 0.5). The relationship of this measure with cardiometabolic risk factors is also comparable with waist circumference measures taken at other sites.  NOTE: Waist circumference can be measured on pregnant women. However, national reference data do not include pregnant women, and waist circumference has different associations with abdominal and total body fat among those who are not pregnant. ",PhenX,RELEASED,2003 National Children's Food Survey,physical,PX021602,,
PX021603,Waist Circumference - Framingham Heart Study,"Waist circumference is measured at several body sites in the scientific literature. This protocol is from the Framingham Heart Study in which measurement of the participant's waist circumference is performed at the level of the umbilicus (i.e., navel or ""belly button""). Although this protocol is still used in surveys and studies, care should be taken in using it because it does not rely on reliable bony landmarks and is biased by degree of abdominal obesity. On the other hand, unlike the protocols that require palpation for bony landmarks (which may be problematic with some populations), an umbilicus is visualized or can be located through thin clothing. In both children and adults and compared with measurements taken using other protocols, measurements taken at the level of the umbilicus tend to be roughly comparable with those taken midway between the lowest rib and iliac crest (NCFS protocol) if the participants are at a normal weight, but measurements tend to be more comparable with or even larger than those taken over the iliac crest (NHANES protocol) when the participant is obese and the umbilicus has been displaced downward (i.e., pendulous abdomen). The relationship of this measure with cardiometabolic risk factors is, however, comparable with waist circumference measures taken at other sites. NOTE: Waist circumference can be measured on pregnant women. However, national reference data do not include pregnant women, and waist circumference has different associations with abdominal and total body fat among those who are not pregnant.",PhenX,RELEASED,"Framingham Heart Study - Offspring Cohort, Exam 5",physical,PX021603,,
PX021701,Serial Pregnancy Weight - Weights Abstracted from Prenatal Charts,"Serial measures of weight either (1) abstracted from health care (prenatal) records or (2) measured prospectively for the duration of gestation. Data collected entail (1) weights measured at all prenatal visits; (2) dates of all prenatal visits; (3) reported pre-pregnancy weight; (4) reported or measured height; and (5) gestational age at every prenatal visit and at delivery. If the opportunity exists to collect the gestational weight prospectively as part of the research protocol, this is preferred because weights taken using a research protocol are better standardized for amount of participant clothing and scales are regularly calibrated.",PhenX,RELEASED,ACOG: American Congress of Obstetricians and Gynecologists Antenatal Form B and C,chart_abstraction,PX021701,,
