PX200101,Audiogram Hearing Test,"The National Health and Nutrition Examination Survey (NHANES) 2008-2009 audiometry protocol tests the examinee's hearing threshold (in decibels, dB) at 7 frequencies in a soundproof room. Examinees are asked a series of exclusionary questions, undergo an outer-ear examination (otoscopy), and then have the mobility of their eardrum tested (acoustic immittance). Pure tone signals are then presented to each ear through earphones and the intensity of the signals is varied until the level is identified at which the person is just able to hear the sound.",PhenX,RELEASED,,clin_exam,PX200101,,
PX200201,Ear Infections (Otitis Media),This protocol contains two interviewer-administered questions from the 2009-2010 National Health and Nutrition Examination Survey (NHANES) that capture the frequency of ear infections and whether or not the respondent has ever had tubes inserted in his/her ears.,PhenX,RELEASED,,interviewer,PX200201,,
PX200301,Early Childhood Speech and Language Assessment - Ages and Stages Questionnaire,"The communication subscale of the Ages & Stages Questionnaires&reg;, Third Edition (ASQ-3&trade;) includes 6 questions that screen young children from 24-30 months for developmental delays in language skills. The ASQ-3&trade; is completed by a parent (or child's caregiver) or by an examiner asking a parent (or child's caregiver) questions about the child. The protocol includes scoring instructions. Additionally, the Brookes Publishing Company offers an optional online management system for ASQ-3&trade; called ASQ Online.",PhenX,RELEASED,,proxy_q,PX200301,,
PX200302,Early Childhood Speech and Language Assessment - Speech and Language Assessment Scale,"The Speech and Language Assessment Scale (SLAS) is a 19-item, parent-report questionnaire designed to identify children with delayed speech and language skills. The SLAS uses seven-point Likert-style questions to assess six subscales: assertiveness, responsiveness, semantics, syntax, articulation, and talkativeness. The protocol includes instructions to generate composite scale scores.",PhenX,RELEASED,,proxy_q,PX200302,,
PX200401,Family History of Speech and Language Impairment,The Family History Questionnaire is a 9-item proxy-administered questionnaire completed by a parent for their young child. It asks about the child's personal and family history of speech and language impairment.,PhenX,RELEASED,,proxy_q,PX200401,,
PX200501,Grammatical Impairments - Clinical Evaluation of Language Fundamentals,"The Recalling Sentences subtest of the Clinical Evaluation of Language Fundamentals&reg;, Fourth Edition (CELF&reg; - 4) is an interviewer-administered test that determines if a student has a language disorder or delayed language development. It asks a student to imitate sentences presented by the examiner. As the test progresses, the sentences become longer and more complex. Respondents are scored for the number of errors made in each sentence. The Clinical Evaluation of Language Fundamentals&reg;, Fourth Edition (CELF&reg; - 4) can be scored using the CELF&reg;-4 Scoring Assistant (purchased separately).",PhenX,RELEASED,,interviewer,PX200501,,
PX200502,Grammatical Impairments - Test of Early Grammatical Impairment,Past Tense Probe and Third Person Singular Probe are interviewer-administered subtests of the Rice/Wexler Test of Early Grammatical Impairment (TEGI). The interviewer uses a picture elicitation task to elicit target forms of grammar. Normative data are available to assist in scoring results.,PhenX,RELEASED,,interviewer,PX200502,,
PX200503,Grammatical Impairments - Grammaticality Judgment Task,The Rice Grammaticality Judgment Task - WH Questions is an examiner-administered 20-item grammar judgment task. The respondent listens to a series of prerecorded sentences (items) and indicates whether or not the sentence is grammatical.,PhenX,RELEASED,,self_comp,PX200503,,
PX200601,Non-word Repetition,Non-word Repetition is an interviewer-administered test that is a part of the Comprehensive Test of Phonological Processing (CTOPP). The respondent listens to a series of nonsense words played on an audio CD and repeats them back to interviewer.,PhenX,RELEASED,,interviewer,PX200601,,
PX200701,Phonemic Inventory,"The Sounds-in-Words Section of the Goldman-Fristoe Test of Articulation, Second Edition (GFTA&trade; -2) is an interviewer-administered test that measures the respondent's articulation of the consonant sounds of Standard American English. The interviewer shows pictures and provides verbal cues to elicit single-word answers from the respondent that demonstrate common speech sounds.",PhenX,RELEASED,,interviewer,PX200701,,
PX200801,Reading Comprehension,The Passage Comprehension Subtest of the Woodcock-Johnson&reg; Tests of Achievement (WJ III&reg;) is an interviewer-administered test in which the respondent is asked to read a short passage and identify a missing key word that makes sense in the context of the passage. The Woodcock-Johnson&reg;  Tests of Achievement (WJ III&reg;) can be scored with either the WJ III&reg; Compuscore and Profiles Program (WCPP) software (included in each kit) or with Report Writer.,PhenX,RELEASED,,interviewer,PX200801,,
PX200901,Stuttering,The Stuttering Severity Instrument - Fourth Edition (SSI-4) is an interviewer-administered test that records a sample of the respondent's speech. The Computerized Scoring of the Stuttering Severity (Version 2; CSSS-2.0) software is provided to facilitate the calculation of frequency and duration of stuttering dysfluencies. The software automatically produces a record of the percentage of syllables stuttered (frequency) and the duration of the three longest stuttering events.,PhenX,RELEASED,,interviewer,PX200901,,
PX201001,Tinnitus,"The Tinnitus Handicap Inventory is a 25-item self-administered questionnaire that assesses the impact of tinnitus on the respondent's general well-being. The Tinnitus Handicap Inventory includes a functional subscale (11 items) that measures limitations of mental, social, and physical functioning; an emotional subscale (9 items) that assesses affective responses such as anger and frustration; and a catastrophic subscale (5 items) that measures items such as desperation. The protocol also includes scoring instructions.",PhenX,RELEASED,,self,PX201001,,
PX201101,Vertigo,"The Dizziness Handicap Inventory (DHI) assesses perceived disability due to dizziness (i.e., vertigo). This 25-item self-administered questionnaire contains three subscales which cover the areas of function, emotion, and physical aspects. Points from each subscale can be combined to assign a total score, or they can be combined by subscale.",PhenX,RELEASED,,self,PX201101,,
PX201201,Vocabulary Assessment,"The Peabody Picture Vocabulary Test, Fourth Edition (PPVT&trade;-4) is an interviewer-administered instrument that measures the receptive (hearing) vocabulary of the respondent. For each item, the examiner says a word and the respondent selects a picture that illustrates the word's meaning. The items sample words that represent 20 content areas (e.g., actions, vegetables, tools), and parts of speech (e.g., nouns, verbs).",PhenX,RELEASED,,interviewer,PX201201,,
PX201301,Voice Impairments,"The Voice Handicap Index (VHI) is a 30-item self-administered questionnaire that asks individuals to describe their voice and the effects of their voice on their life. Three subscales cover the areas of functional, emotional, and physical aspects of voice disorders. Points from the questions can be combined to assign a total score, or they can be combined by subscale.",PhenX,RELEASED,,self,PX201301,,
PX201401,Word Decoding,The Test of Word Reading Efficiency (TOWRE) is a nationally normed measure of word reading accuracy and fluency. The test contains two subtests: the Sight Word Efficiency (SWE) subtest and the Phonetic Decoding Efficiency (PDE) subtest. The Sight Word Efficiency subtest involves presenting the respondent with a list of real printed words. The respondent must accurately read and pronounce as many words as possible in 45 seconds. The Phonetic Decoding Efficiency subtest involves presenting a list of printed non-words. The respondent must accurately decode and pronounce as many words as possible in 45 seconds. The examiner scores each item as it is being pronounced.,PhenX,RELEASED,,interviewer,PX201401,,
PX201501,Personal and Family History of Hearing Loss,"The Age-Related Hearing Impairment instrument is a self-administered questionnaire which asks about an individual's hearing impairment history, history of ear diseases and operations, family history, and history of exposure to loud noises.",PhenX,RELEASED,,self,PX201501,,
PX210101,Childhood Maltreatment,"The Childhood Trauma QuestionnaireShort Form (CTQ) is a 28-item, self-reported questionnaire administered to adolescents and adults to identify traumatic childhood conditions. The CTQ includes five subscales: physical abuse, emotional abuse, sexual abuse, physical neglect, and emotional neglect. The questionnaire also includes a minimalization/denial scale for detecting individuals who may be underreporting traumatic events. The respondent reviews the list of items and chooses the response that best describes his or her experiences.",PhenX,RELEASED,"CTQ: Childhood Trauma Questionnaire, 1997",self,PX210101,,
PX210201,Child-Reported Parental Education Attainment,"This protocol includes two questions from the National Longitudinal Study on Adolescent Health (Add Health) that ask the respondent to report on the highest level of education achieved by his or her residential parents (i.e., while growing up). The question may be administered via interview or through self-report questionnaire.",PhenX,RELEASED,"Add Health: National Longitudinal Study on Adolescent Health, 1995",self_or_interviewer,PX210201,,
PX210302,Discrimination,"The Major Experiences and Everyday Discrimination Scales include 19 interviewer-administered, yes-or-no and frequency response category questions. The Major Experiences subscale includes 9 questions about employment, housing, and education; the Everyday Discrimination subscale includes 10 questions about interactions with other people, including courtesy, respect, and harassment. A follow-up question to &quot;yes&quot; responses is also administered to probe about the reason for the discrimination as being related to race, gender, age, religion, disability, and so forth.  ",PhenX,RELEASED,Major Experiences and Everyday Discrimination Scales,interviewer,PX210302,,
PX210401,Family Conflict - Intimate-Relationship,The Revised Conflict Tactics Scales (CTS 2) is a 78-item questionnaire that assesses both positive and negative behaviors used in response to conflict between romantic partners in the past year. It can be self-administered or administered by an interviewer as part of a personal interview.,PhenX,RELEASED,"CTS 2: Revised Conflict Tactics Scales, 2003.",self_or_interviewer,PX210401,,
PX210402,Family Conflict - Parent-Child,"The Conflict Tactics Scales: Parent-Child Version (CTS PC) is a 35-item questionnaire given to adult parents of children or given to children themselves that evaluates how parents deal with conflict with their child, including nonviolent discipline, psychological aggression, and physical assault in the parent-child relationship. The respondent reviews the list of items and chooses a response from an eight-point Likert scale that best describes the strategies used by the parent to manage conflict with the child. It can be self-administered or administered by an interview as part of a personal interview.",PhenX,RELEASED,"CTS PC: Conflict Tactics Scales: Parent-Child Version, 2003.",self_or_interviewer,PX210402,,
PX210501,Family Control and Organization,"The System Maintenance protocol includes 18 self-administered, true/false questions from two subscales (Organization, Control) of the Family Environment Scale (FES), Fourth Edition. The respondent reviews each item and chooses whether each item is characteristic (True) or not characteristic (False) of their family. The FES Manual includes a Scoring Key for each true/false item. This protocol is appropriate for adults and children aged 11 and older.",PhenX,RELEASED,"FES: Family Environment Scale, 2009",self,PX210501,,
PX210601,Family Interpersonal Relationships,"The Family Interpersonal Relationships protocol includes 27 self-administered, true/false questions from three subscales (Cohesion, Expressiveness, and Conflict) of the Family Environment Scale (FES), Fourth Edition. The respondent reviews each item and chooses whether each item is characteristic (true) or not characteristic (false) of his or her family. The FES Manual includes a scoring key for each true/false item. This protocol is appropriate for adults and children aged 11 years and older.",PhenX,RELEASED,"FES: Family Environment Scale, 2009",self,PX210601,,
PX210701,Healthy Food Environments,"The Perceived Availability of Healthy Foods Scale from the Multi-Ethnic Study of Atherosclerosis (MESA) is a three-item, interviewer-administered scale that measures the quality and availability of fresh fruit and vegetables and low-fat products in the local neighborhood. Higher mean scores indicate greater availability of healthy foods in the neighborhood (i.e., low-fat products, fruits, and vegetables).",PhenX,RELEASED,"MESA: Multi-Ethnic Study of Atherosclerosis, 2000, Neighborhood Section",interviewer,PX210701,,
PX210801,Neighborhood Collective Efficacy - Community Cohesion and Informal Social Control,"This protocol includes 10 Likert-style, interviewer-administered questions from the Project on Human Development in Chicago Neighborhoods (PHDCN). The Social Cohesion and Informal Social Control subscales include five items each.",PhenX,RELEASED,"PHDCN: Project on Human Development in Chicago Neighborhoods, Community Survey, 1994-1995.",interviewer,PX210801,,
PX210901,Neighborhood Safety,"The Mujahid et al. (2007) protocol includes three interviewer-administered questions with five-point, Likert-style responses. For each question posed by the interviewer, the respondent reviews the list of responses and chooses the answer that best relates to his or her situation. ",PhenX,RELEASED,Neighborhood Safety,interviewer,PX210901,,
PX211001,School Social Environment,"The protocol includes 39 self-administered questions developed by Zullig et al. (2010). The items are scored with a five-point Likert scale, from strongly disagree to strongly agree, and include eight subscales: teacher relationships, school connectedness, academic support, order and discipline, school physical environment, school social environment, perceived exclusion/privilege, and academic satisfaction. The respondent reviews a list of items and chooses the answer that best relates to himself or herself.",PhenX,RELEASED,School Social Environment,self,PX211001,,
PX211101,Social Networks,"The Important and Health Matters Social Network Battery is an interviewer-administered survey that captures the names of all individuals within a respondent's social network and the relationship between these individuals. The high-burden protocol is a semistructured interview that has both open-ended and close-ended questions. On average, it takes 15&ndash;20 minutes to complete because individuals usually provide 4&ndash;7 names.",PhenX,RELEASED,"INMHS: Indianapolis Network Mental Health Study, 1990-1991",interviewer,PX211101,,
PX211201,Job Strain,"This protocol includes 15 self-administered questions from the Skill Discretion (seven items), Decision Authority (three items), and Psychological Job Demands (five items) subscales of the Job Content Questionnaire. The protocol includes basic instructions for scoring the subscales and using the subscales to calculate job strain.",PhenX,RELEASED,Job Content Questionnaire,self,PX211201,,
PX211302,Neighborhood Concentrated Disadvantage,"The protocol is based on extracting data from the U.S. Census Bureau on a set of variables related to the concept of ""concentrated disadvantage"" (Sampson, Raudenbush, & Earls, 1997). All the relevant variables are available from the long form of the 1990 and 2000 Decennial Censuses (SF3) and from the 5-year American Community Survey (ACS) estimates. ACS estimates are annually updated; current 5-year data sets range from 2005&ndash;2009 to 2010&ndash;2014. Once the data are extracted, an index score of concentrated disadvantage can be calculated at the neighborhood level of interest; this is usually based on census tract or census block group data. ",PhenX,RELEASED,"SF3-ACS: U.S. Census Bureau, 1990 and 2000 Decennial Censuses, and American Community Survey, 5-year estimates, 2005-2009 to 2010-2014.",secondary,PX211302,,
PX211402,Race/Ethnic Residential Segregation - U.S. Census,"The protocol is based on extracting data from the U.S. Census Bureau on a set of variables related to the concept of residential segregation. Residential segregation describes the distribution of different race/ethnic groups across smaller areal units (e.g., census tracts) within larger areas (e.g., counties or metropolitan statistical areas [MSAs]). The Dissimilarity Index is one of the most commonly used race/ethnic residential segregation measures. All the relevant variables are available from the decennial censuses or the American Community Survey (ACS) 5-year estimates. Once the data are extracted the proposed measure, the Dissimilarity Index can be calculated. Which data set should be used?Users interested in using measures of residential segregation in conjunction with the Neighborhood Concentrated Disadvantage protocol should use data from the ACS 5-year estimates for consistency of data sources. Users who are interested in using the 100% count data rather than estimates, or making comparisons of residential segregation in metropolitan areas across time (e.g. 1990 vs. 2010) should use data from the decennial censuses. The protocol here describes how to use Summary File 1 (SF1) files (i.e., 100% sample data) from the decennial censuses to calculate the Dissimilarity Index. Users interested in using the ACS data should refer to the other protocol for this measure. ",PhenX,RELEASED,"U.S. Census Bureau, decennial censuses for 1990, 2000, 2010",secondary,PX211402,,
PX211403,Race/Ethnic Residential Segregation - American Community Survey,"The protocol is based on extracting data from the U.S. Census Bureau on a set of variables related to the concept of residential segregation. Residential segregation describes the distribution of different race/ethnic groups across smaller areal units (e.g., census tracts) within larger areas (e.g., counties or metropolitan statistical areas [MSAs]). The Dissimilarity Index is one of the most commonly used race/ethnic residential segregation measures. All the relevant variables are available from the decennial censuses or the American Community Survey (ACS) 5-year estimates. Once the data are extracted, the Dissimilarity Index can be calculated. Which data set should be used?Users interested in using measures of residential segregation in conjunction with the Neighborhood Concentrated Disadvantage protocol should use data from the ACS 5-year estimates for consistency of data sources. Users who are interested in using the 100% count data rather than estimates or making comparisons of residential segregation in metropolitan areas across time (e.g., 1990 vs. 2010) should use data from the Decennial Censuses. The protocol here describes the process using 5-year estimates from the ACS. Users interested in using the Decennial Census data should refer to the alternate protocol.",PhenX,RELEASED,ACS: American Community Survey 5-year estimates,secondary,PX211403,,
PX211501,Life Events - Child,"The Adverse Life Events Scale is a self- or proxy-administered, 25-item questionnaire that reports events experienced during the previous year over which the child had little or no control. The respondent reviews the list of items and indicates which events have occurred.",PhenX,RELEASED,Adverse Life Events Scale,self_or_proxy_q,PX211501,,
PX211502,Life Events - Adult,"The Traumatic Life Events Questionnaire (TLEQ) is a self-administered questionnaire to assess current and prior exposure to potentially traumatic events (e.g., from natural disasters to sexual abuse). Follow-up probes ask whether respondents felt fear, helplessness, or horror during any event experienced. Additional questions ask about physical injury and immediate emotional response to the event. For exposure to multiple events, respondents are asked to indicate which event they perceive as the worst.",PhenX,RELEASED,TLEQ: Traumatic Life Events Questionnaire ,self,PX211502,,
PX220101,Ataxia Rating Scale,"The Scale for the Assessment and Rating of Ataxia (SARA) is a clinical scale used to assess cerebellar ataxia. The scale includes 8 items that are related to gait, stance, sitting, speech, finger-chase test, nose-finger test, fast alternating movements and heel-shin test. A trained physician observes the participant perform these physical function tests and gives each one a value from the scale.",PhenX,RELEASED,,measurement,PX220101,,
PX220201,Body Proportions,"The arm span to height comparison is determined by measuring the individual's arm span and standing height and then comparing the two measurements (e.g., arm span is 3 centimeters greater than height). The upper to lower body segment ratio is a physical measurement of an individual's upper segment versus lower body segment and expressed as a ratio (e.g., 1.2:1).",PhenX,RELEASED,,measurement,PX220201,,
PX220301,Bone Age,"The latest Tanner and Whitehouse Method, sometimes referred to as TW2, involves the interpretation of a radiograph of the left hand and wrist by a trained radiologist. The procedure includes the assessment of regions of interest (ROI) on 20 bones. The ROI include the epiphysis, metaphysis and diaphysis of each bone. The radiologist gives each ROI a numerical score and records the result. The numerical score of each ROI is summed to produce a total score. ",PhenX,RELEASED,,radiologic,PX220301,,
PX220401,Child Oral Health Pain,"The Child Oral Health Impact Profile-Short Form 19 (COHIP-SF 19) is a 19-item interviewer-administered questionnaire about the oral health of a child to assess the child's quality of life. This questionnaire can be administered to children aged 8-17 years old.  The COHIP-SF 19 is derived from the Child Oral Health Impact Profile, which is administered to parents and contains 34 questions. The COHIP-SF 19 covers the areas of school environment, self-image, social-emotional well-being, and functional well-being.",PhenX,RELEASED,,interviewer,PX220401,,
PX220501,Complete Blood Count (CBC),The Complete Blood Count (CBC) protocol is a standard blood panel from the National Health and Nutrition Examination Survey (NHANES) and performed on participants aged 1 and older. Blood is collected from participants via standard venipuncture in a 3 or 4 ml K<sub>3</sub> EDTA tube. The ambient blood sample is placed into a hematological analyzer for CBC and differential analyses. The blood should be tested as soon as possible after venipuncture and no later than 24 hours.,PhenX,RELEASED,,bioassay,PX220501,,
PX220601,Disability Index,The Oswestry Disability Index (ODI &#169;) version 2.1a is a 10-item proprietary self-administered questionnaire that asks questions regarding how an individual's back (or leg) trouble affects the ability to perform routine daily activities.,PhenX,RELEASED,,self,PX220601,,
PX220701,Disease Progression and Regression - 0-24 Months,"The Newcastle Paediatric Mitochondrial Disease Scale (NPMDS) and the Newcastle Mitochondrial Disease Adult Scale (NMDAS) can be used to evaluate the progression of mitochondrial disease. There are three versions of the NPMDS, each for a specific age range (0-24 months, 2-11 years, and 12-18 years). The NMDAS is for adult patients over 16 years. The scales allow for standardization of patient assessment and to improve accurate data collection. The scales are composed of multiple domains: Current Function, System Specific Involvement, Current Clinical Assessment and Quality of Life. Almost all questions provide a score which ranges from 0 to 3, with the following representations: 0 is normal, 1 is mild, 2 is moderate, and 3 is severe. Examples of severity for each question are provided. Depending upon the domain, the questions are either self- or interviewer-administrated, based on a provider's clinical assessment or medical records. There is a manual for each scale, which details the administration, process, and scoring instructions.",PhenX,RELEASED,,proxy_q,PX220701,,
PX220702,Disease Progression and Regression - 2-11 Years,"The Newcastle Paediatric Mitochondrial Disease Scale (NPMDS) and the Newcastle Mitochondrial Disease Adult Scale (NMDAS) can be used to evaluate the progression of mitochondrial disease. There are three versions of the NPMDS, each for a specific age range (0-24 months, 2-11 years, and 12-18 years). The NMDAS is for adult patients over 16 years. The aim of the scales is to allow for standardization of patient assessment and to improve accurate data collection. The scales are composed of multiple domains: Current Function, System Specific Involvement, Current Clinical Assessment, and Quality of Life. Almost all questions provide a score which ranges from 0-3, with the following representations: 0 is normal, 1 is mild, 2 moderate, and 3 severe. Examples of each severity for each question are provided. Depending on the domain, the questions are either self-administrated or based on a provider's clinical assessment. There is a manual for each scale, which details the administration, process, and scoring instructions.",PhenX,RELEASED,,self_or_proxy_q,PX220702,,
