Variable / Field Name,Form Name,Section Header,Field Type,Field Label,"Choices, Calculations, OR Slider Labels",Field Note,Text Validation Type OR Show Slider Number,Text Validation Min,Text Validation Max,Identifier?,Branching Logic (Show field only if...),Required Field?,Custom Alignment,Question Number (surveys only),Matrix Group Name,Matrix Ranking?
hip_circumference_1_jpg,phenx_hip_circumference_hip_circumference,,descriptive,Figure 1.,,PX020802,,,,,,,,,,
hip_circumference_tape_measure_placement,phenx_hip_circumference_hip_circumference,,radio,"With the subject standing upright with feet together and weight evenly distributed, did the examiner gather the fabric of the subject's pants, holding the sides of the pants snugly, before placing the steel measuring tape around the hips, anchoring the measuring tape at the maximum protuberance of the buttocks?","UNDEFINED_CODE,Yes|UNDEFINED_CODE_1,No",PX020802,,,,,,,,,,
hip_circumference_tape_measure_adjustment,phenx_hip_circumference_hip_circumference,,radio,Did the examiner then release the folds of the pants and then adjust the tape so that it is on a horizontal plane and held snugly but not pulled tight?,"UNDEFINED_CODE,Yes|UNDEFINED_CODE_1,No",PX020802,,,,,,,,,,
hip_circumference_measurement_1,phenx_hip_circumference_hip_circumference,,text,What was the hip measurement?,,centimeters | | PX020802,,,,,,,,,,
hip_circumference_measurement_2,phenx_hip_circumference_hip_circumference,,text,What was the hip measurement?,,centimeters | | PX020802,,,,,,,,,,
hip_circumference_measurement_3,phenx_hip_circumference_hip_circumference,,text,What was the hip measurement?,,centimeters | | PX020802,,,,,,,,,,
