Variable / Field Name,Form Name,Section Header,Field Type,Field Label,"Choices, Calculations, OR Slider Labels",Field Note,Text Validation Type OR Show Slider Number,Text Validation Min,Text Validation Max,Identifier?,Branching Logic (Show field only if...),Required Field?,Custom Alignment,Question Number (surveys only),Matrix Group Name,Matrix Ranking?
occupational_prestige_record_id,phenx_occupational_prestige,,text,Record ID,,PX270501,,,,,,,,,,
instructions,phenx_occupational_prestige,,descriptive,"Employment Questions from the American Community Survey. For employed people, the data refer to the person's job during the previous week. For those who worked two or more jobs, the data refer to the job where the person worked the greatest number of hours. For unemployed people and people who are not currently employed but report having a job within the last five years, the data refer to their last job.",,PX270501,,,,,,,,,,
occupational_prestige_kind_work_doing,phenx_occupational_prestige,,text,"What kind of work was this person doing? (For example: registered nurse, personnel manager, supervisor of order department, secretary, accountant)",,PX270501,,,,,,,,,,
occupational_prestige_most_important_activities_describe,phenx_occupational_prestige,,text,"What were this person's most important activities or duties? Describe the activity at the location where employed. (For example: patient care, directing hiring policies, supervising order clerks, typing and filing, reconciling financial records) ",,PX270501,,,,,,,,,,
prestige_score_description,phenx_occupational_prestige,,descriptive,"Prestige Scores from the General Social Survey. In the OCCUPATIONAL CLASSIFICATION DISTRIBUTIONS codebook, the U.S. Census Bureau assigned a three-digit number code to each occupational title. These codes appear under the column headed ""Punch, Occupation"". Match the user response to the job title. The respective occupational 'Prestige Score' can be found in the same row (e.g. Accountants have a prestige score of 57). Access to the code book can be found here:<a href=""http://gss.norc.org/documents/codebook/GSS_Codebook_AppendixF.pdf"">http://gss.norc.org/documents/codebook/GSS_Codebook_AppendixF.pdf</a>",,PX270501,,,,,,,,,,
