Variable / Field Name,Form Name,Section Header,Field Type,Field Label,"Choices, Calculations, OR Slider Labels",Field Note,Text Validation Type OR Show Slider Number,Text Validation Min,Text Validation Max,Identifier?,Branching Logic (Show field only if...),Required Field?,Custom Alignment,Question Number (surveys only),Matrix Group Name,Matrix Ranking?
mode_delivery_cesarean_delivery_history,phenx_mode_of_delivery_interview,,radio,"Before you had your new baby, did you ever have a baby by cesarean delivery or c-section (when a doctor cuts through the mother?s belly to bring out the baby)?","1,No| 2,Yes",PX241301,,,,,,,,,,
mode_delivery_new_baby,phenx_mode_of_delivery_interview,,radio,How was your new baby delivered?,"UNDEFINED_CODE,Vaginally (if yes, then skip to question 5)| UNDEFINED_CODE_1,Cesarean delivery (c-section)",PX241301,,,,,,,,,,
mode_delivery_cesarean_idea_initiation,phenx_mode_of_delivery_interview,,radio,Which statement best describes whose idea it was for you to have a cesarean delivery (c-section)? Check ONE answer,"UNDEFINED_CODE,My health care provider recommended a cesarean delivery before I went into labor| UNDEFINED_CODE_1,My health care provider recommended a cesarean delivery while I was in labor| UNDEFINED_CODE_2,I asked for the cesarean delivery",PX241301,,,,,,,,,,
mode_delivery_cesarean_reason,phenx_mode_of_delivery_interview,,radio,What was the reason that your new baby was born by cesarean delivery (c-section)? Check ALL that apply,"UNDEFINED_CODE, I had a previous cesarean delivery (c-section) | UNDEFINED_CODE_1, My baby was in the wrong position (such as breech) | UNDEFINED_CODE_2, I was past my due date | UNDEFINED_CODE_3, My health care provider worried that my baby was too big | UNDEFINED_CODE_4, I had a medical condition that made labor dangerous for me (such as heart condition, physical disability) | UNDEFINED_CODE_5, I had a complication in my pregnancy (such as preeclampsia, placental problems, infection, preterm labor) | UNDEFINED_CODE_6, My health care provider tried to induce my labor, but it didn't work | UNDEFINED_CODE_7, Labor was taking too long | UNDEFINED_CODE_8, The fetal monitor showed that my baby was having problems before or during labor (fetal distress) | UNDEFINED_CODE_9, I wanted to schedule my delivery | UNDEFINED_CODE_10, I didn't want to have my baby vaginally | UNDEFINED_CODE_11, Other",PX241301,,,,,,,,,,
mode_delivery_cesarean_reason_other,phenx_mode_of_delivery_interview,,text,What was the reason that your new baby was born by cesarean delivery (c-section)? Other. Please specify,,PX241301,,,,,[mode_delivery_cesarean_reason] = 'UNDEFINED_CODE_11',,,,,
mode_delivery_induce_labor,phenx_mode_of_delivery_interview,,radio,"Did your doctor, nurse, or other health care worker try to induce your labor (start your contractions using medicine)?","1, No; Skip Item 6|2, Yes|UNDEFINED_CODE,I don't know; Skip Item 6",PX241301,,,,,,,,,,
mode_delivery_induce_labor_reason,phenx_mode_of_delivery_interview,,radio,"Why did your doctor, nurse, or other health care worker try to induce your labor (start your contractions using medicine)? Check ALL that apply","UNDEFINED_CODE, My water broke and there was a fear of infection | UNDEFINED_CODE_1, I was past my due date | UNDEFINED_CODE_2, My health care provider worried about the size of the baby | UNDEFINED_CODE_3, My baby was not doing well and needed to be born | UNDEFINED_CODE_4, I had a complication in my pregnancy (such as low amniotic fluid or preeclampsia) | UNDEFINED_CODE_5, Labor stopped or was not progressing | UNDEFINED_CODE_6, I wanted to schedule my delivery | UNDEFINED_CODE_7, I wanted to give birth with a specific health care provider | UNDEFINED_CODE_8, Other",PX241301,,,,,,,,,,
mode_delivery_induce_labor_reason_other,phenx_mode_of_delivery_interview,,text,"Why did your doctor, nurse, or other health care worker try to induce your labor (start your contractions using medicine)? Other. Please specify",,PX241301,,,,,[mode_delivery_induce_labor_reason] = 'UNDEFINED_CODE_8',,,,,
